timestamp,title,url,source
11-15-2024,"Cooling Towers Market Projected to Surpass US$5 Billion by 2029, Fueled by Technological Innovations and Industrial Boom | 2024 Industry Research",https://www.globenewswire.com/news-release/2024/11/15/2981825/28124/en/Cooling-Towers-Market-Projected-to-Surpass-US-5-Billion-by-2029-Fueled-by-Technological-Innovations-and-Industrial-Boom-2024-Industry-Research.html,GlobeNewswire Inc.
11-15-2024,Pressure Vessels Market to Surpass Valuation of USD 77.46 Billion by 2031 | SkyQuest Technology,https://www.globenewswire.com/news-release/2024/11/15/2981733/0/en/Pressure-Vessels-Market-to-Surpass-Valuation-of-USD-77-46-Billion-by-2031-SkyQuest-Technology.html,GlobeNewswire Inc.
09-26-2024,"Fluidized Bed Concentrator (FBC) Market to Reach $4.9 Billion, Globally, by 2032 at 7.9% CAGR: Allied Market Research",https://www.globenewswire.com/news-release/2024/09/26/2953983/0/en/Fluidized-Bed-Concentrator-FBC-Market-to-Reach-4-9-Billion-Globally-by-2032-at-7-9-CAGR-Allied-Market-Research.html,GlobeNewswire Inc.
07-23-2024,Absorption Tower Market Size is Projected to Reach USD 2.8 - GlobeNewswire,https://www.globenewswire.com/news-release/2024/07/23/2917491/0/en/Absorption-Tower-Market-Size-is-Projected-to-Reach-USD-2-8-billion-by-2034-Garnering-a-4-8-CAGR-by-2034-Transparency-Market-Research-Inc.html,GlobeNewswire Inc.
06-28-2024,Babcock & Wilcox (BW) Is Attractively Priced Despite Fast-paced Momentum,https://www.zacks.com/stock/news/2294831/babcock-wilcox-bw-is-attractively-priced-despite-fast-paced-momentum,Zacks Investment Research
06-24-2024,"Beat the Market Like Zacks: Freshpet, AudioEye, Walmart in Focus",https://www.zacks.com/stock/news/2292088/beat-the-market-like-zacks-freshpet-audioeye-walmart-in-focus,Zacks Investment Research
05-17-2024,Babcock & Wilcox (BW) Shows Fast-paced Momentum But Is Still a Bargain Stock,https://www.zacks.com/stock/news/2275232/babcock-wilcox-bw-shows-fast-paced-momentum-but-is-still-a-bargain-stock,Zacks Investment Research
05-08-2024,"RingCentral (RNG) Q1 Earnings Top Estimates, Revenues Up Y/Y",https://www.zacks.com/stock/news/2270831/ringcentral-rng-q1-earnings-top-estimates-revenues-up-yy,Zacks Investment Research
05-08-2024,"Toast (TOST) Q1 Loss Narrower Than Expected, Revenues Up Y/Y",https://www.zacks.com/stock/news/2270613/toast-tost-q1-loss-narrower-than-expected-revenues-up-yy,Zacks Investment Research
05-08-2024,"Reddit (RDDT) Q1 Earnings Beat Estimates, Revenues Up Y/Y",https://www.zacks.com/stock/news/2270607/reddit-rddt-q1-earnings-beat-estimates-revenues-up-yy,Zacks Investment Research
04-23-2024,"Bears are Losing Control Over Babcock & Wilcox (BW), Here's Why It's a 'Buy' Now",https://www.zacks.com/stock/news/2260158/bears-are-losing-control-over-babcock-wilcox-bw-heres-why-its-a-buy-now,Zacks Investment Research
04-16-2024,Babcock & Wilcox (BW) Upgraded to Buy: Here's Why,https://www.zacks.com/stock/news/2256262/babcock-wilcox-bw-upgraded-to-buy-heres-why,Zacks Investment Research
03-29-2024,B. Riley Financial: Audit Risk May Have Potential Rewards,https://seekingalpha.com/article/4681182-b-riley-financial-stock-audit-risk-may-have-potential-rewards,Seeking Alpha
03-25-2024,ITT to Invest $11M for Pump Testing Capabilities Enhancement,https://www.zacks.com/stock/news/2245410/itt-to-invest-11m-for-pump-testing-capabilities-enhancement,Zacks Investment Research
03-15-2024,Why Jabil Shares Are Trading Lower By Over 14%? Here Are Other Stocks Moving In Friday's Mid-Day Session,https://www.benzinga.com/news/24/03/37756640/why-jabil-shares-are-trading-lower-by-over-14-here-are-other-stocks-moving-in-fridays-mid-day-sessio,Benzinga
03-15-2024,"Adobe, Buckle And 3 Stocks To Watch Heading Into Friday",https://www.benzinga.com/news/earnings/24/03/37724709/adobe-buckle-and-3-stocks-to-watch-heading-into-friday,Benzinga
12-14-2023,New Strong Sell Stocks for December 14th,https://www.zacks.com/stock/news/2197723/new-strong-sell-stocks-for-december-14th,Zacks Investment Research
11-15-2023,Why Shapeways Holdings Shares Are Trading Lower By Around 20%? Here Are Other Stocks Moving In Wednesday's Mid-Day Session,https://www.benzinga.com/news/23/11/35812714/why-shapeways-holdings-shares-are-trading-lower-by-around-20-here-are-other-stocks-moving-in-wednesd,Benzinga
11-10-2023,Nasdaq Jumps 250 Points; Trade Desk Issues Weak Revenue Forecast,https://www.benzinga.com/news/earnings/23/11/35733231/nasdaq-jumps-250-points-trade-desk-issues-weak-revenue-forecast,Benzinga
11-10-2023,Why Wynn Resorts Shares Are Trading Lower By Around 8%? Here Are Other Stocks Moving In Friday's Mid-Day Session,https://www.benzinga.com/news/23/11/35731734/why-wynn-resorts-shares-are-trading-lower-by-around-8-here-are-other-stocks-moving-in-fridays-mid-da,Benzinga
11-10-2023,Crude Oil Rises 2%; US Consumer Sentiment Falls In November,https://www.benzinga.com/news/earnings/23/11/35729904/crude-oil-rises-2-us-consumer-sentiment-falls-in-november,Benzinga
11-10-2023,Dow Gains Over 100 Points; Wynn Resorts Earnings Top Views,https://www.benzinga.com/news/earnings/23/11/35726157/dow-gains-over-100-points-wynn-resorts-earnings-top-views,Benzinga
11-01-2023,Generac Holdings (GNRC) Q3 Earnings and Revenues Beat Estimates,https://www.zacks.com/stock/news/2176075/generac-holdings-gnrc-q3-earnings-and-revenues-beat-estimates,Zacks Investment Research
10-04-2023,"Acuity Brands, RPM International, LiveVox Holdings And Other Big Stocks Moving Higher On Wednesday",https://www.benzinga.com/news/23/10/35090276/acuity-brands-rpm-international-livevox-holdings-and-other-big-stocks-moving-higher-on-wednesday,Benzinga
08-08-2023,"Babcock & Wilcow Enterprises (BW) Reports Q2 Loss, Tops Revenue Estimates",https://www.zacks.com/stock/news/2134038/babcock-wilcow-enterprises-bw-reports-q2-loss-tops-revenue-estimates,Zacks Investment Research
08-02-2023,Generac Holdings (GNRC) Lags Q2 Earnings Estimates,https://www.zacks.com/stock/news/2130876/generac-holdings-gnrc-lags-q2-earnings-estimates,Zacks Investment Research
06-21-2023,Strength Seen in Generac Holdings (GNRC): Can Its 7.9% Jump Turn into More Strength?,https://www.zacks.com/stock/news/2110945/strength-seen-in-generac-holdings-gnrc-can-its-79-jump-turn-into-more-strength,Zacks Investment Research
06-08-2023,Insiders Buying Dollar General And 2 Other Stocks,https://www.benzinga.com/trading-ideas/long-ideas/23/06/32775813/insiders-buying-dollar-general-and-2-other-stocks,Benzinga
05-11-2023,Why Groupon Shares Are Trading Lower By 22%? Here Are Other Stocks Moving In Thursday's Mid-Day Session,https://www.benzinga.com/news/23/05/32348458/why-groupon-shares-are-trading-lower-by-22-here-are-other-stocks-moving-in-thursdays-mid-day-session,Benzinga
05-10-2023,"Babcock & Wilcow Enterprises (BW) Reports Q1 Loss, Tops Revenue Estimates",https://www.zacks.com/stock/news/2093180/babcock-wilcow-enterprises-bw-reports-q1-loss-tops-revenue-estimates,Zacks Investment Research
05-03-2023,Generac Holdings (GNRC) Tops Q1 Earnings and Revenue Estimates,https://www.zacks.com/stock/news/2088747/generac-holdings-gnrc-tops-q1-earnings-and-revenue-estimates,Zacks Investment Research
03-15-2023,"Adobe, SentinelOne And 3 Stocks To Watch Heading Into Wednesday",https://www.benzinga.com/news/earnings/23/03/31355148/adobe-sentinelone-and-3-stocks-to-watch-heading-into-wednesday,Benzinga
03-15-2023,Investor Fear Eases Following Rebound In Bank Shares,https://www.benzinga.com/news/earnings/23/03/31354907/investor-fear-eases-following-rebound-in-bank-shares,Benzinga
11-30-2022,Penny Stocks To Buy: 6 Insider Picks Before December 2022,https://pennystocks.com/featured/2022/11/30/penny-stocks-to-buy-6-insider-picks-before-december-2022/,PennyStocks
11-25-2022,Babcock (BW) Is a Trending Stock: Facts to Know Before Betting on It,https://www.zacks.com/stock/news/2022299/babcock-bw-is-a-trending-stock-facts-to-know-before-betting-on-it,Zacks Investment Research
11-15-2022,Why Infinity Pharmaceuticals Shares Tumbled Around 38%; Here Are 79 Biggest Movers From Yesterday,https://www.benzinga.com/news/22/11/29722376/why-infinity-pharmaceuticals-shares-tumbled-around-38-here-are-79-biggest-movers-from-yesterday,Benzinga
11-15-2022,"Miniso Group, Monday.com And Other Big Gainers From Monday",https://www.benzinga.com/news/22/11/29720363/miniso-group-monday-com-and-other-big-gainers-from-monday,Benzinga
11-14-2022,Why Opiant Pharmaceuticals Shares Are Trading Higher By 115%? Here Are 53 Stocks Moving In Monday's Mid-Day Session,https://www.benzinga.com/news/22/11/29708256/why-opiant-pharmaceuticals-shares-are-trading-higher-by-115-here-are-53-stocks-moving-in-mondays-mid,Benzinga
11-14-2022,Investors Heavily Search Babcock (BW): Here is What You Need to Know,https://www.zacks.com/stock/news/2017783/investors-heavily-search-babcock-bw-here-is-what-you-need-to-know,Zacks Investment Research
11-09-2022,"Babcock & Wilcow Enterprises (BW) Reports Q3 Loss, Tops Revenue Estimates",https://www.zacks.com/stock/news/2015833/babcock-wilcow-enterprises-bw-reports-q3-loss-tops-revenue-estimates,Zacks Investment Research
11-02-2022,Why Harsco Shares Surged Over 22%; Here Are 80 Biggest Movers From Yesterday,https://www.benzinga.com/news/22/11/29516617/why-harsco-shares-surged-over-22-here-are-80-biggest-movers-from-yesterday,Benzinga
11-01-2022,Why Abiomed Shares Are Trading Higher By Over 50%? Here Are 60 Stocks Moving In Tuesday's Mid-Day Session,https://www.benzinga.com/news/22/11/29506317/why-abiomed-shares-are-trading-higher-by-over-50-here-are-60-stocks-moving-in-tuesdays-mid-day-sessi,Benzinga
11-01-2022,"Goodyear Tire, Catalent, Zebra Technologies And Some Other Big Stocks Moving Lower On Tuesday",https://www.benzinga.com/news/22/11/29504982/goodyear-tire-catalent-zebra-technologies-and-some-other-big-stocks-moving-lower-on-tuesday,Benzinga
10-28-2022,Babcock (BW) is Attracting Investor Attention: Here is What You Should Know,https://www.zacks.com/stock/news/2006229/babcock-bw-is-attracting-investor-attention-here-is-what-you-should-know,Zacks Investment Research
10-28-2022,Why Meta Platforms Shares Dipped Around 25%; Here Are 77 Biggest Movers From Yesterday,https://www.benzinga.com/news/22/10/29454000/why-meta-platforms-shares-dipped-around-25-here-are-77-biggest-movers-from-yesterday,Benzinga
10-27-2022,Dow Surges 350 Points; Crude Oil Rises,https://www.benzinga.com/news/earnings/22/10/29445373/dow-surges-350-points-crude-oil-rises,Benzinga
10-27-2022,Why UserTesting Shares Are Trading Higher By Around 93%? Here Are 53 Stocks Moving In Thursday's Mid-Day Session,https://www.benzinga.com/news/22/10/29443347/why-usertesting-shares-are-trading-higher-by-around-93-here-are-53-stocks-moving-in-thursdays-mid-da,Benzinga
10-27-2022,Nasdaq Down 100 Points; McDonald's Profit Tops Views,https://www.benzinga.com/news/earnings/22/10/29442652/nasdaq-down-100-points-mcdonalds-profit-tops-views,Benzinga
10-27-2022,"Credit Suisse, Meta Platforms, Wolfspeed And Some Other Big Stocks Moving Lower On Thursday",https://www.benzinga.com/news/22/10/29441550/credit-suisse-meta-platforms-wolfspeed-and-some-other-big-stocks-moving-lower-on-thursday,Benzinga
10-24-2022,Babcock & Wilcow Enterprises (BW) Gains But Lags Market: What You Should Know,https://www.zacks.com/stock/news/1996363/babcock-wilcow-enterprises-bw-gains-but-lags-market-what-you-should-know,Zacks Investment Research
