timestamp,title,url,source
03-07-2024,Why HighPeak Energy Shares Are Trading Lower By 15%? Here Are Other Stocks Moving In Thursday's Mid-Day Session,https://www.benzinga.com/news/24/03/37542750/why-highpeak-energy-shares-are-trading-lower-by-15-here-are-other-stocks-moving-in-thursdays-mid-day,Benzinga
03-07-2024,Why Rush Street Interactive Shares Are Trading Higher By Around 25%; Here Are 20 Stocks Moving Premarket,https://www.benzinga.com/news/24/03/37532292/why-rush-street-interactive-shares-are-trading-higher-by-around-25-here-are-20-stocks-moving-premark,Benzinga
03-06-2024,Why United Natural Foods Shares Are Trading Lower By 15%? Here Are Other Stocks Moving In Wednesday's Mid-Day Session,https://www.benzinga.com/news/24/03/37517720/why-united-natural-foods-shares-are-trading-lower-by-15-here-are-other-stocks-moving-in-wednesdays-m,Benzinga
03-06-2024,Dow Jumps 200 Points; Abercrombie & Fitch Posts Upbeat Profit,https://www.benzinga.com/news/earnings/24/03/37510913/dow-jumps-200-points-abercrombie-fitch-posts-upbeat-profit,Benzinga
03-06-2024,Why CrowdStrike Shares Are Trading Higher By Around 24%; Here Are 20 Stocks Moving Premarket,https://www.benzinga.com/news/24/03/37507247/why-crowdstrike-shares-are-trading-higher-by-around-24-here-are-20-stocks-moving-premarket,Benzinga
03-05-2024,Why SOPHiA GENETICS Shares Are Trading Lower By 19%? Here Are Other Stocks Moving In Tuesday's Mid-Day Session,https://www.benzinga.com/news/24/03/37489986/why-sophia-genetics-shares-are-trading-lower-by-19-here-are-other-stocks-moving-in-tuesdays-mid-day,Benzinga
02-20-2024,Why Fluor Shares Are Trading Lower By Around 8%? Here Are Other Stocks Moving In Tuesday's Mid-Day Session,https://www.benzinga.com/news/24/02/37219277/why-fluor-shares-are-trading-lower-by-around-8-here-are-other-stocks-moving-in-tuesdays-mid-day-sess,Benzinga
02-20-2024,Why Discover Financial Services Shares Are Trading Higher By Around 11%; Here Are 20 Stocks Moving Premarket,https://www.benzinga.com/news/24/02/37210416/why-discover-financial-services-shares-are-trading-higher-by-around-11-here-are-20-stocks-moving-pre,Benzinga
02-19-2024,Factors Setting the Tone for Quanta Services' (PWR) Q4 Earnings,https://www.zacks.com/stock/news/2227826/factors-setting-the-tone-for-quanta-services-pwr-q4-earnings,Zacks Investment Research
02-19-2024,Gibraltar (ROCK) to Report Q4 Earnings: Here's What to Expect,https://www.zacks.com/stock/news/2227757/gibraltar-rock-to-report-q4-earnings-heres-what-to-expect,Zacks Investment Research
02-14-2024,Why Sony Shares Are Trading Lower By Around 6%? Here Are Other Stocks Moving In Wednesday's Mid-Day Session,https://www.benzinga.com/news/24/02/37134445/why-sony-shares-are-trading-lower-by-around-6-here-are-other-stocks-moving-in-wednesdays-mid-day-ses,Benzinga
02-14-2024,Nasdaq Gains 100 Points; Kraft Heinz Sales Miss Views,https://www.benzinga.com/news/earnings/24/02/37126934/nasdaq-gains-100-points-kraft-heinz-sales-miss-views,Benzinga
01-29-2024,Why Panbela Therapeutics Shares Are Trading Lower By 65%? Here Are Other Stocks Moving In Monday's Mid-Day Session,https://www.benzinga.com/news/24/01/36831323/why-panbela-therapeutics-shares-are-trading-lower-by-65-here-are-other-stocks-moving-in-mondays-mid,Benzinga
01-25-2024,Why Humana Shares Are Trading Lower By Over 11%? Here Are Other Stocks Moving In Thursday's Mid-Day Session,https://www.benzinga.com/news/24/01/36788242/why-humana-shares-are-trading-lower-by-over-11-here-are-other-stocks-moving-in-thursdays-mid-day-ses,Benzinga
12-21-2023,The Massive Increase In U.S. Energy Production - Its Investment Implications (Part 4) - Alternate Energy,https://seekingalpha.com/article/4658845-massive-increase-energy-production-implications-part-4-alternate-energy,Seeking Alpha
11-24-2023,Implied Volatility Surging for Enviva (EVA) Stock Options,https://www.zacks.com/stock/news/2188904/implied-volatility-surging-for-enviva-eva-stock-options,Zacks Investment Research
11-15-2023,Top 4 Energy Stocks That Are Preparing To Pump This Month,https://www.benzinga.com/trading-ideas/long-ideas/23/11/35803026/top-4-energy-stocks-that-are-preparing-to-pump-this-month,Benzinga
11-10-2023,Why Wynn Resorts Shares Are Trading Lower By Around 8%? Here Are Other Stocks Moving In Friday's Mid-Day Session,https://www.benzinga.com/news/23/11/35731734/why-wynn-resorts-shares-are-trading-lower-by-around-8-here-are-other-stocks-moving-in-fridays-mid-da,Benzinga
11-10-2023,Analyst Expectations for Enviva's Future,https://www.benzinga.com/analyst-ratings/23/11/35722675/analyst-expectations-for-envivas-future,Benzinga
11-09-2023,Dow Falls Over 200 Points; Krispy Kreme Reports Downbeat Results,https://www.benzinga.com/news/earnings/23/11/35710265/dow-falls-over-200-points-krispy-kreme-reports-downbeat-results,Benzinga
11-09-2023,Why AMC Entertainment Shares Are Trading Lower By Around 14%? Here Are Other Stocks Moving In Thursday's Mid-Day Session,https://www.benzinga.com/news/23/11/35707883/why-amc-entertainment-shares-are-trading-lower-by-around-14-here-are-other-stocks-moving-in-thursday,Benzinga
11-09-2023,Crude Oil Rises Over 1%; Tapestry Posts Upbeat Earnings,https://www.benzinga.com/news/earnings/23/11/35705816/crude-oil-rises-over-1-tapestry-posts-upbeat-earnings,Benzinga
11-09-2023,US Stocks Mostly Flat; Jobless Claims Decline In Latest Week,https://www.benzinga.com/news/earnings/23/11/35701601/us-stocks-mostly-flat-jobless-claims-decline-in-latest-week,Benzinga
10-18-2023,Why Nuvve Holding Shares Are Trading Lower By 45%? Here Are Other Stocks Moving In Wednesday's Mid-Day Session,https://www.benzinga.com/news/23/10/35315673/why-nuvve-holding-shares-are-trading-lower-by-45-here-are-other-stocks-moving-in-wednesdays-mid-day,Benzinga
10-11-2023,Annaly Capital: A Maleficent 14% Yield,https://seekingalpha.com/article/4640117-annaly-maleficent-14-percent-yield,Seeking Alpha
10-09-2023,Why ParaZero Technologies Shares Are Trading Higher By Over 100%? Here Are Other Stocks Moving In Monday's Mid-Day Session,https://www.benzinga.com/news/23/10/35149464/why-parazero-technologies-shares-are-trading-higher-by-over-100-here-are-other-stocks-moving-in-mond,Benzinga
10-06-2023,Why CalAmp Shares Are Trading Lower By Around 32%? Here Are Other Stocks Moving In Friday's Mid-Day Session,https://www.benzinga.com/news/23/10/35130518/why-calamp-shares-are-trading-lower-by-around-32-here-are-other-stocks-moving-in-fridays-mid-day-ses,Benzinga
10-04-2023,Where Enviva Stands With Analysts,https://www.benzinga.com/analyst-ratings/23/10/35096597/where-enviva-stands-with-analysts,Benzinga
10-03-2023,"Boise Cascade (BCC) Buys Brockway-Smith, Fortifies BMD Unit",https://www.zacks.com/stock/news/2159512/boise-cascade-bcc-buys-brockway-smith-fortifies-bmd-unit,Zacks Investment Research
09-19-2023,Top 2 Energy Stocks Which Could Rescue Your Portfolio This Quarter,https://www.benzinga.com/trading-ideas/long-ideas/23/09/34721704/top-2-energy-stocks-which-could-rescue-your-portfolio-this-quarter,Benzinga
06-30-2023,Enviva (EVA) to Build More Wood Pellets From New Alabama Plant,https://www.zacks.com/stock/news/2115410/enviva-eva-to-build-more-wood-pellets-from-new-alabama-plant,Zacks Investment Research
05-24-2023,Top 4 Energy Stocks That Could Blast Off This Quarter,https://www.benzinga.com/trading-ideas/long-ideas/23/05/32550168/top-4-energy-stocks-that-could-blast-off-this-quarter,Benzinga
05-23-2023,Nasdaq Down 1%; AutoZone Posts Downbeat Sales,https://www.benzinga.com/news/earnings/23/05/32538496/nasdaq-down-1-autozone-posts-downbeat-sales,Benzinga
05-23-2023,US Stocks Pare Losses; Services PMI Rises In May,https://www.benzinga.com/news/earnings/23/05/32535367/us-stocks-pare-losses-services-pmi-rises-in-may,Benzinga
05-19-2023,New Strong Sell Stocks for May 19th,https://www.zacks.com/stock/news/2097209/new-strong-sell-stocks-for-may-19th,Zacks Investment Research
05-15-2023,What 9 Analyst Ratings Have To Say About Enviva,https://www.benzinga.com/analyst-ratings/23/05/32402133/what-9-analyst-ratings-have-to-say-about-enviva,Benzinga
05-09-2023,Top 5 Energy Stocks You'll Regret Missing This Month,https://www.benzinga.com/trading-ideas/long-ideas/23/05/32284966/top-5-energy-stocks-youll-regret-missing-this-month,Benzinga
05-08-2023,Why Tredegar Shares Are Trading Lower By 15%? Here Are Other Stocks Moving In Monday's Mid-Day Session,https://www.benzinga.com/news/23/05/32269542/why-tredegar-shares-are-trading-lower-by-15-here-are-other-stocks-moving-in-mondays-mid-day-session,Benzinga
05-08-2023,Crude Oil Rises Over 2%; US Wholesale Inventories Unchanged For March,https://www.benzinga.com/news/earnings/23/05/32268494/crude-oil-rises-over-2-us-wholesale-inventories-unchanged-for-march,Benzinga
05-08-2023,"Six Flags Entertainment, Zscaler, Energizer And Other Big Stocks Moving Higher On Monday",https://www.benzinga.com/news/23/05/32266428/six-flags-entertainment-zscaler-energizer-and-other-big-stocks-moving-higher-on-monday,Benzinga
05-08-2023,US Stocks Edge Lower; Tyson Foods Posts Q2 Loss,https://www.benzinga.com/news/earnings/23/05/32265745/us-stocks-edge-lower-tyson-foods-posts-q2-loss,Benzinga
05-05-2023,Nasdaq Surges Over 2%; Fluor Posts Downbeat Earnings,https://www.benzinga.com/news/earnings/23/05/32246061/nasdaq-surges-over-2-fluor-posts-downbeat-earnings,Benzinga
05-05-2023,"No More Dividends For Enviva, Weak Operational Performance And Guidance Cut, Analyst Downgrades Stock",https://www.benzinga.com/analyst-ratings/analyst-color/23/05/32243306/no-more-dividends-for-enviva-weak-operational-performance-and-guidance-cut-analyst-,Benzinga
05-05-2023,Why Enviva Stock Is Up Today,https://www.fool.com/investing/2023/05/05/why-enviva-stock-is-up-today/,The Motley Fool
05-05-2023,Why Atlassian Shares Are Trading Lower By 10%? Here Are Other Stocks Moving In Friday's Mid-Day Session,https://www.benzinga.com/news/23/05/32244206/why-atlassian-shares-are-trading-lower-by-10-here-are-other-stocks-moving-in-fridays-mid-day-session,Benzinga
05-05-2023,Crude Oil Rises Sharply; Johnson Controls Earnings Beat Views,https://www.benzinga.com/news/earnings/23/05/32243301/crude-oil-rises-sharply-johnson-controls-earnings-beat-views,Benzinga
05-05-2023,"Apple, AIG, Cigna And Other Big Stocks Moving Higher On Friday",https://www.benzinga.com/news/23/05/32241546/apple-aig-cigna-and-other-big-stocks-moving-higher-on-friday,Benzinga
05-05-2023,"Dow Jumps 400 Points; US Economy Adds 253,000 Jobs In April",https://www.benzinga.com/news/earnings/23/05/32240109/dow-jumps-400-points-us-economy-adds-253-000-jobs-in-april,Benzinga
05-04-2023,Nasdaq Down 50 Points; ConocoPhillips Posts Upbeat Earnings,https://www.benzinga.com/news/earnings/23/05/32223203/nasdaq-down-50-points-conocophillips-posts-upbeat-earnings,Benzinga
05-04-2023,Why Synaptics Shares Are Trading Lower By 17%? Here Are Other Stocks Moving In Thursday's Mid-Day Session,https://www.benzinga.com/news/23/05/32222842/why-synaptics-shares-are-trading-lower-by-17-here-are-other-stocks-moving-in-thursdays-mid-day-sessi,Benzinga
