timestamp,title,url,source
02-19-2025,These Were the 5 Top-Performing Stocks in the S&P 500 in January 2025,https://www.fool.com/investing/2025/02/19/top-performing-stocks-in-sp-500-january-2025/?source=iedfolrf0000001,The Motley Fool
02-11-2025,"[Latest] Global Aircraft Component Market Size/Share Worth USD 1,599.5 Billion by 2034 at a 5.28% CAGR: Custom Market Insights (Analysis, Outlook, Leaders, Report, Trends, Forecast, Segmentation, Growth, Growth Rate, Value)",https://www.globenewswire.com/news-release/2025/02/11/3023924/0/en/Latest-Global-Aircraft-Component-Market-Size-Share-Worth-USD-1-599-5-Billion-by-2034-at-a-5-28-CAGR-Custom-Market-Insights-Analysis-Outlook-Leaders-Report-Trends-Forecast-Segmentat.html,GlobeNewswire Inc.
02-09-2025,What's a Fair Price to Buy General Electric (GE) Stock?,https://www.fool.com/investing/2025/02/09/whats-a-fair-price-to-buy-general-electric-ge-stoc/?source=iedfolrf0000001,The Motley Fool
02-06-2025,Connected Device Analytics Market to Surpass USD 173.96B by 2032 due to IoT and AI Integration Growth | Research by SNS Insider,https://www.globenewswire.com/news-release/2025/02/06/3022156/0/en/Connected-Device-Analytics-Market-to-Surpass-USD-173-96B-by-2032-due-to-IoT-and-AI-Integration-Growth-Research-by-SNS-Insider.html,GlobeNewswire Inc.
02-01-2025,Every GE Aerospace Investor Should Keep an Eye on This Number,https://www.fool.com/investing/2025/02/01/every-ge-aerospace-investor-should-keep-an-eye-on/?source=iedfolrf0000001,The Motley Fool
02-01-2025,Where Will GE Aerospace Be in a Year?,https://www.fool.com/investing/2025/02/01/where-will-ge-aerospace-be-in-a-year/?source=iedfolrf0000001,The Motley Fool
01-28-2025,Global Aerospace Offers Valuable Insights on the Ever Evolving Engine Technologies in the Aviation Industry,https://www.globenewswire.com/news-release/2025/01/28/3016841/0/en/Global-Aerospace-Offers-Valuable-Insights-on-the-Ever-Evolving-Engine-Technologies-in-the-Aviation-Industry.html,GlobeNewswire Inc.
01-23-2025,Why GE Aerospace Stock Is Flying High Today,https://www.fool.com/investing/2025/01/23/why-ge-aerospace-stock-is-flying-high-today/?source=iedfolrf0000001,The Motley Fool
01-23-2025,GE Aerospace Crushes Q4 EPS Expectations,https://www.fool.com/data-news/2025/01/23/ge-aerospace-crushes-q4-eps-expectations/?source=iedfolrf0000001,The Motley Fool
01-14-2025,Precision Parts Market Outlook & Forecast Report 2024-2029: Rise of Industry 4.0 and Smart Precision Manufacturing,https://www.globenewswire.com/news-release/2025/01/14/3009108/28124/en/Precision-Parts-Market-Outlook-Forecast-Report-2024-2029-Rise-of-Industry-4-0-and-Smart-Precision-Manufacturing.html,GlobeNewswire Inc.
01-10-2025,Q4 Earnings Season Preview: S&P 500 Stocks Poised for Strongest Growth in 3 Years,https://www.investing.com/analysis/q4-earnings-season-preview-sp-500-stocks-poised-for-strongest-growth-in-3-years-200656072,Investing.com
01-09-2025,Here's Why GE Aerospace Stock Crushed the Market in 2024,https://www.fool.com/investing/2025/01/09/heres-why-ge-aerospace-stock-crushed-the-market-in/?source=iedfolrf0000001,The Motley Fool
12-30-2024,"Aircraft Digital Cockpit Market Research: Control Panels, Displays, Sensors, Connectivity Solutions, Application, End-user - Global Forecasts 2025-2030",https://www.globenewswire.com/news-release/2024/12/30/3002545/28124/en/Aircraft-Digital-Cockpit-Market-Research-Control-Panels-Displays-Sensors-Connectivity-Solutions-Application-End-user-Global-Forecasts-2025-2030.html,GlobeNewswire Inc.
12-28-2024,"GE Aerospace: Buy, Sell, or Hold?",https://www.fool.com/investing/2024/12/28/ge-aerospace-buy-sell-or-hold/?source=iedfolrf0000001,The Motley Fool
12-16-2024,"Advanced Materials for Extreme Environments Market Report, with Profiles of Leading Companies, including General Electric Co., Saint-Gobain, 3M, Kyocera and Denka Company",https://www.globenewswire.com/news-release/2024/12/16/2997668/28124/en/Advanced-Materials-for-Extreme-Environments-Market-Report-with-Profiles-of-Leading-Companies-including-General-Electric-Co-Saint-Gobain-3M-Kyocera-and-Denka-Company.html,GlobeNewswire Inc.
12-16-2024,"Global Digital Mobile X-Ray Devices Market Set to Achieve USD 7,728.7 Million by 2034, Driven by Innovations in Medical Imaging Technology | Future Market Insights, Inc.",https://www.globenewswire.com/news-release/2024/12/16/2997217/0/en/Global-Digital-Mobile-X-Ray-Devices-Market-Set-to-Achieve-USD-7-728-7-Million-by-2034-Driven-by-Innovations-in-Medical-Imaging-Technology-Future-Market-Insights-Inc.html,GlobeNewswire Inc.
12-10-2024,"Electric Motor Rotor Shaft Market Set for 6.4% CAGR Growth, Projected to Hit USD 4.44 billion by 2034 | PMR",https://www.globenewswire.com/news-release/2024/12/10/2994227/0/en/Electric-Motor-Rotor-Shaft-Market-Set-for-6-4-CAGR-Growth-Projected-to-Hit-USD-4-44-billion-by-2034-PMR.html,GlobeNewswire Inc.
12-09-2024,"Latin America Artificial Lift Market Set to Expand at a Staggering 4.3% CAGR, Reaching USD 1,208.32 million by 2032 | PMR",https://www.globenewswire.com/news-release/2024/12/09/2993486/0/en/Latin-America-Artificial-Lift-Market-Set-to-Expand-at-a-Staggering-4-3-CAGR-Reaching-USD-1-208-32-million-by-2032-PMR.html,GlobeNewswire Inc.
12-07-2024,Where Will GE Aerospace Be in 4 Years?,https://www.fool.com/investing/2024/12/07/where-will-ge-aerospace-be-in-4-years/?source=iedfolrf0000001,The Motley Fool
12-06-2024,"Protective Relay Market Set to Expand at a Staggering 5.5% CAGR, Reaching $4.59 billion by 2034 | PMR",https://www.globenewswire.com/news-release/2024/12/06/2992847/0/en/Protective-Relay-Market-Set-to-Expand-at-a-Staggering-5-5-CAGR-Reaching-4-59-billion-by-2034-PMR.html,GlobeNewswire Inc.
12-05-2024,Steam Turbine Market to Propel Growth at USD 20.32 Billion by 2031,https://www.benzinga.com/pressreleases/24/12/g42336250/steam-turbine-market-to-propel-growth-at-usd-20-32-billion-by-2031,Benzinga
11-19-2024,Think GE Aerospace Is Expensive? This Chart Might Change Your Mind.,https://www.fool.com/investing/2024/11/19/ge-aerospace-stock-expensive-this-chart-mind/?source=iedfolrf0000001,The Motley Fool
11-18-2024,Honeywell Just Hit an All-Time High: Could Breaking Up This Dow Dividend Stock Unlock Even More Value?,https://www.fool.com/investing/2024/11/18/honeywell-buy-dividend-dow-stock-activist-investor/?source=iedfolrf0000001,The Motley Fool
11-17-2024,"GE Aerospace Stock: Buy, Sell, or Hold?",https://www.fool.com/investing/2024/11/17/ge-aerospace-stock-buy-sell-or-hold/?source=iedfolrf0000001,The Motley Fool
11-15-2024,Pressure Vessels Market to Surpass Valuation of USD 77.46 Billion by 2031 | SkyQuest Technology,https://www.globenewswire.com/news-release/2024/11/15/2981733/0/en/Pressure-Vessels-Market-to-Surpass-Valuation-of-USD-77-46-Billion-by-2031-SkyQuest-Technology.html,GlobeNewswire Inc.
11-05-2024,"Aviation Analytics Market is expected to generate a revenue of USD 5.55 Billion by 2031, Globally, at 11.40% CAGR: Verified Market Research®",https://www.globenewswire.com/news-release/2024/11/05/2975041/0/en/Aviation-Analytics-Market-is-expected-to-generate-a-revenue-of-USD-5-55-Billion-by-2031-Globally-at-11-40-CAGR-Verified-Market-Research.html,GlobeNewswire Inc.
10-29-2024,"Aerospace 3D Printing Market is Forecasted to Reach US$ 4.5 Billion in 2027, Says Stratview Research",https://www.globenewswire.com/news-release/2024/10/29/2971304/0/en/Aerospace-3D-Printing-Market-is-Forecasted-to-Reach-US-4-5-Billion-in-2027-Says-Stratview-Research.html,GlobeNewswire Inc.
10-29-2024,The Market Missed Something Important in GE Aerospace's Big News. Here's What You Need to Know.,https://www.fool.com/investing/2024/10/28/the-market-missed-something-important-in-ge-aerosp/?source=iedfolrf0000001,The Motley Fool
10-28-2024,GE Aerospace Partners with Waygate Technologies To Elevate Engine Inspections With AI,https://www.benzinga.com/markets/equities/24/10/41577655/ge-aerospace-partners-with-waygate-technologies-to-elevate-engine-inspections-with-ai,Benzinga
10-26-2024,GE Aerospace Shares Fall Despite Upbeat Outlook. Is It Time to Buy the Stock on the Dip?,https://www.fool.com/investing/2024/10/26/ge-aerospace-shares-fall-despite-upbeat-outlook-is/?source=iedfolrf0000001,The Motley Fool
10-23-2024,Here's Why GE Aerospace Stock Recovered Today,https://www.fool.com/investing/2024/10/23/heres-why-ge-aerospace-stock-recovered-today/?source=iedfolrf0000001,The Motley Fool
10-23-2024,GE Aerospace And Lilium Join Forces To Turbocharge eVTOL Safety Standards,https://www.benzinga.com/markets/equities/24/10/41493084/ge-aerospace-and-lilium-join-forces-to-turbocharge-evtol-safety-standards,Benzinga
10-23-2024,9 Charts Showing Stocks Poised for Deeper Pullback as Key Indexes Break Trendlines,https://www.investing.com/analysis/9-charts-showing-stocks-poised-for-deeper-pullback-as-key-indexes-break-trendlines-200653299,Investing.com
10-22-2024,"GE Aerospace Q3 Earnings: Orders Surge, Lifts Earnings Outlook & More",https://www.benzinga.com/news/earnings/24/10/41450452/ge-aerospace-q3-earnings-orders-surge-lifts-earnings-outlook-more,Benzinga
10-20-2024,"1 Stock to Buy, 1 Stock to Sell This Week: GE Aerospace, UPS",https://www.investing.com/analysis/1-stock-to-buy-1-stock-to-sell-this-week-ge-aerospace-ups-200653184,Investing.com
10-20-2024,Here's What Honeywell's Big News Means for Investors,https://www.fool.com/investing/2024/10/19/heres-what-honeywells-big-news-means-to-investors/?source=iedfolrf0000001,The Motley Fool
10-17-2024,Is a Beat in the Offing for GE Aerospace in Q3 Earnings?,https://www.benzinga.com/news/earnings/24/10/41383390/is-a-beat-in-the-offing-for-ge-aerospace-in-q3-earnings,Benzinga
10-16-2024,Why I Keep Buying These 14 Incredible Growth Stocks,https://www.fool.com/investing/2024/10/16/why-i-keep-buying-these-14-incredible-growth-stock/?source=iedfolrf0000001,The Motley Fool
10-10-2024,Valve Positioner Market Size to Worth USD 2.63 Billion by 2033 | Straits Research,https://www.globenewswire.com/news-release/2024/10/10/2961476/0/en/Valve-Positioner-Market-Size-to-Worth-USD-2-63-Billion-by-2033-Straits-Research.html,GlobeNewswire Inc.
10-05-2024,The New Face of GE: Why Aerospace Might Be Worth the Wait,https://www.fool.com/investing/2024/10/05/the-new-face-of-ge-why-aerospace-might-be-worth-th/?source=iedfolrf0000001,The Motley Fool
10-03-2024,GE and Howmet Poised for Strong Earnings as Aerospace Sector Stays Resilient: Analyst,https://www.benzinga.com/analyst-ratings/analyst-color/24/10/41172749/ge-and-howmet-poised-for-strong-earnings-as-aerospace-sector-stays-resilient-analys,Benzinga
09-25-2024,This Under-the-Radar Sector Is Getting Ready to Take Flight Amid Falling Rates,https://www.investing.com/analysis/this-undertheradar-sector-is-getting-ready-to-take-flight-amid-falling-rates-200652258,Investing.com
09-25-2024,This Under-the-Radar Sector Is Getting Ready to Take Flight as Amid Falling Rates,https://www.investing.com/analysis/this-undertheradar-sector-is-getting-ready-to-take-flight-as-amid-falling-rates-200652210,Investing.com
09-25-2024,"Medium Voltage Fuse Market to record $628 Mn by 2032, Says Global Market Insights Inc.",https://www.globenewswire.com/news-release/2024/09/25/2952741/0/en/Medium-Voltage-Fuse-Market-to-record-628-Mn-by-2032-Says-Global-Market-Insights-Inc.html,GlobeNewswire Inc.
09-03-2024,Here's Why GE Aerospace Stock Slumped Today,https://www.fool.com/investing/2024/09/03/heres-why-ge-aerospace-stock-slumped-today/?source=iedfolrf0000001,The Motley Fool
09-02-2024,"[VPP] Virtual Power Plants Market Share to Hit USD 15.8 Billion by 2034, at 24.8% CAGR: Prophecy Market Insights",https://www.globenewswire.com/news-release/2024/09/02/2939114/0/en/VPP-Virtual-Power-Plants-Market-Share-to-Hit-USD-15-8-Billion-by-2034-at-24-8-CAGR-Prophecy-Market-Insights.html,GlobeNewswire Inc.
08-29-2024,Should You Invest in the iShares U.S. Aerospace & Defense ETF?,https://www.benzinga.com/news/large-cap/24/08/40622809/should-you-invest-in-the-ishares-u-s-aerospace-defense-etf,Benzinga
08-28-2024,Intelligent Traffic Management System Market Size to Worth USD 27.27 Billion by 2033,https://www.globenewswire.com/news-release/2024/08/28/2937276/0/en/Intelligent-Traffic-Management-System-Market-Size-to-Worth-USD-27-27-Billion-by-2033.html,GlobeNewswire Inc.
08-27-2024,Better Buy: GE Aerospace vs. Lockheed Martin,https://www.fool.com/investing/2024/08/27/better-buy-ge-aerospace-vs-lockheed-martin/?source=iedfolrf0000001,The Motley Fool
08-19-2024,Next Hydrogen to Supply Latest Generation Electrolysis Technology for Renewable Energy Ammonia Production Research,https://www.globenewswire.com/news-release/2024/08/19/2932000/0/en/Next-Hydrogen-to-Supply-Latest-Generation-Electrolysis-Technology-for-Renewable-Energy-Ammonia-Production-Research.html,GlobeNewswire Inc.
