timestamp,title,url,source
07-19-2024,U.S. stocks lower at close of trade; Dow Jones Industrial Average down 0.93% - Investing.com,https://www.investing.com/news/stock-market-news/us-stocks-lower-at-close-of-trade-dow-jones-industrial-average-down-093-3527744,Investing.com
07-19-2024,SunPower continues freefall after dealer letter By Investing.com - Investing.com Canada,https://ca.investing.com/news/stock-market-news/sunpower-continues-freefall-after-dealer-letter-432SI-3506125,Investing.com
07-19-2024,"Scholastic Posts Downbeat Results, Joins Beyond Meat And Other Big Stocks Moving Lower In Friday Pre-Market Session - Benzinga",https://www.benzinga.com/news/24/07/39858003/scholastic-posts-downbeat-results-joins-beyond-meat-and-other-big-stocks-moving-lower-in-friday-pre,Benzinga
07-19-2024,"Nasdaq, S&P 500 Futures Point To Jittery Start: What's Going On - Invesco QQQ Trust, Series 1 (NASDAQ:QQQ), SPDR S&P 500 (ARCA:SPY) - Benzinga",https://www.benzinga.com/news/earnings/24/07/39857014/wall-street-set-to-end-week-on-subdued-note-as-crowdstrike-microsoft-drop-amid-global-outage-analys,Benzinga
07-19-2024,Why Intuitive Surgical Shares Are Trading Higher By Around 7%; Here Are 20 Stocks Moving Premarket - Benzinga,https://www.benzinga.com/news/24/07/39855176/why-intuitive-surgical-shares-are-trading-higher-by-around-7-here-are-20-stocks-moving-premarket,Benzinga
07-13-2024,"ROSEN, A LEADING AND RANKED FIRM, Encourages Maxeon Solar - GlobeNewswire",https://www.globenewswire.com/news-release/2024/07/13/2912694/673/en/ROSEN-A-LEADING-AND-RANKED-FIRM-Encourages-Maxeon-Solar-Technologies-Ltd-Investors-to-Secure-Counsel-Before-Important-Deadline-in-Securities-Class-Action-MAXN.html,GlobeNewswire Inc.
07-11-2024,Why Solar Energy Stocks Soared on Thursday - The Motley Fool,https://www.fool.com/investing/2024/07/11/why-solar-energy-stocks-soared-on-thursday/,The Motley Fool
07-08-2024,Why Renewable Energy Stocks Plunged in June - The Motley Fool,https://www.fool.com/investing/2024/07/08/why-renewable-energy-stocks-plunged-in-june/,The Motley Fool
07-08-2024,"ROSEN, GLOBAL INVESTOR COUNSEL, Encourages Maxeon Solar Technologies, Ltd. Investors to Secure Counsel ... - GlobeNewswire",https://www.globenewswire.com/news-release/2024/07/08/2909353/673/en/ROSEN-GLOBAL-INVESTOR-COUNSEL-Encourages-Maxeon-Solar-Technologies-Ltd-Investors-to-Secure-Counsel-Before-Important-Deadline-in-Securities-Class-Action-MAXN.html,GlobeNewswire Inc.
07-05-2024,Why SunPower Plunged Today - The Motley Fool,https://www.fool.com/investing/2024/07/05/why-sunpower-plunged-today/,The Motley Fool
07-05-2024,Global EV Solar Modules Market Size To Worth USD 2591.6 Million By 2033 l CAGR Of 19.40% - GlobeNewswire,https://www.globenewswire.com/news-release/2024/07/05/2909095/0/en/Global-EV-Solar-Modules-Market-Size-To-Worth-USD-2591-6-Million-By-2033-l-CAGR-Of-19-40.html,GlobeNewswire Inc.
06-13-2024,Arista Networks and Rockwell  Automation have been highlighted as Zacks Bull and Bear of the Day,https://www.zacks.com/stock/news/2287609/arista-networks-and-rockwell-automation-have-been-highlighted-as-zacks-bull-and-bear-of-the-day,Zacks Investment Research
06-12-2024,Brian's Big Idea on Meme Stocks,https://www.zacks.com/stock/news/2287497/brians-big-idea-on-meme-stocks,Zacks Investment Research
06-12-2024,"Why ChargePoint, SunPower, and Sunnova Energy Stocks All Popped Today",https://www.fool.com/investing/2024/06/12/why-chargepoint-sunpower-sunnova-stocks-all-popped/,The Motley Fool
06-12-2024,Solar Revolution Gaining Traction: 3 Stocks to Keep an Eye on,https://www.zacks.com/stock/news/2287146/solar-revolution-gaining-traction-3-stocks-to-keep-an-eye-on,Zacks Investment Research
06-12-2024,"Down 61%, Is Enphase Energy Finally a Buy?",https://www.fool.com/investing/2024/06/12/down-61-is-enphase-energy-finally-a-buy/,The Motley Fool
06-10-2024,"FuelCell Energy (FCEL) Reports Q2 Loss, Tops Revenue Estimates",https://www.zacks.com/stock/news/2285809/fuelcell-energy-fcel-reports-q2-loss-tops-revenue-estimates,Zacks Investment Research
06-09-2024,Wall Street Breakfast: The Week Ahead,https://seekingalpha.com/article/4698248-wall-street-breakfast-week-ahead,Seeking Alpha
06-07-2024,Why SunPower Stock Popped on Friday,https://www.fool.com/investing/2024/06/07/why-sunpower-stock-popped-on-friday/,The Motley Fool
05-31-2024,SunPower (SPWR) Stock Sinks As Market Gains: Here's Why,https://www.zacks.com/stock/news/2282353/sunpower-spwr-stock-sinks-as-market-gains-heres-why,Zacks Investment Research
05-31-2024,Enphase Energy (ENPH) NEM 3.0 Sees High Distribution in California,https://www.zacks.com/stock/news/2282081/enphase-energy-enph-nem-30-sees-high-distribution-in-california,Zacks Investment Research
05-29-2024,Enphase Energy (ENPH) Begins IQ Battery 5P Shipment in Mexico,https://www.zacks.com/stock/news/2280511/enphase-energy-enph-begins-iq-battery-5p-shipment-in-mexico,Zacks Investment Research
05-29-2024,History Says Tariffs Won't Save EV Stocks,https://www.fool.com/investing/2024/05/29/history-says-tariffs-wont-save-ev-stocks/,The Motley Fool
05-29-2024,"Solar Energy Stocks Make a Comeback, but Will It Last?",https://www.fool.com/investing/2024/05/29/solar-energy-stocks-make-a-comeback-but-will-it-la/,The Motley Fool
05-26-2024,Wall Street Breakfast: The Week Ahead,https://seekingalpha.com/article/4695712-wall-street-breakfast-week-ahead,Seeking Alpha
05-22-2024,"Why Solar Stocks First Solar, SunPower, and Sunnova Rocketed Higher Today",https://www.fool.com/investing/2024/05/22/why-solar-stocks-first-solar-sunpower-and-sunnova/,The Motley Fool
05-22-2024,"Stocks Falter, Metals Fall As Traders Turn Cautious Ahead Of Fed Minutes, Nvidia Earnings; First Solar Hits Record Highs: What's Driving Markets Wednesday?",https://www.benzinga.com/markets/equities/24/05/38969645/stocks-falter-metals-fall-as-traders-turn-cautious-ahead-of-fed-minutes-nvidia-earnings-first-so,Benzinga
05-17-2024,Why Renewable Energy Stocks Had an Amazing Week,https://www.fool.com/investing/2024/05/17/sunpower-sunnova-chargepoint-blink/,The Motley Fool
05-17-2024,What Is a Short Squeeze and Why Should You Care?,https://www.fool.com/investing/2024/05/17/what-is-a-short-squeeze-and-why-should-you-care/,The Motley Fool
05-16-2024,"SunPower Stock Jumped 91% in 2 Days, But What's Next?",https://www.fool.com/investing/2024/05/16/sunpower-stock-jumped-91-in-2-days-but-whats-next/,The Motley Fool
05-15-2024,Why SunPower Stock Got Burned Today,https://www.fool.com/investing/2024/05/15/why-sunpower-stock-got-burned-today/,The Motley Fool
05-15-2024,This Accenture Analyst Is No Longer Bullish; Here Are Top 5 Downgrades For Today,https://www.benzinga.com/news/24/05/38842172/this-accenture-analyst-is-no-longer-bullish-here-are-top-5-downgrades-for-today,Benzinga
05-15-2024,3 Questions to Ask Before Buying a Penny Stock in 2024,https://pennystocks.com/featured/2024/05/15/3-questions-ask-before-buying-penny-stock-2024/,PennyStocks
05-14-2024,Nasdaq Closes at New Record High; CPI on Deck,https://www.zacks.com/stock/news/2273796/nasdaq-closes-at-new-record-high-cpi-on-deck,Zacks Investment Research
05-14-2024,"SunPower Stock Jumped 105%, Leading Residential Solar Energy Stocks",https://www.fool.com/investing/2024/05/14/sunpower-stock-jumps-92-leading-residential-solar/,The Motley Fool
05-14-2024,"Wall Street Trades Flat On Mixed Producer Inflation; Meme Stocks See Wild Ride, Bitcoin Drops: What's Driving Markets Tuesday?",https://www.benzinga.com/markets/equities/24/05/38825000/wall-street-trades-flat-on-mixed-producer-inflation-meme-stocks-see-wild-ride-bitcoin-drops-what,Benzinga
05-14-2024,"Biden Announces Massive Tariffs On Chinese Imports To Protect US Industries: Clean Energy, Solar Stocks Rally",https://www.benzinga.com/markets/asia/24/05/38824198/biden-announces-massive-tariffs-on-chinese-imports-to-protect-us-industries-clean-energy-solar-stock,Benzinga
05-14-2024,"New Hotter Inflation Data – Momo Buys The Dip, Fed Blunder Shows Up In Roaring Meme Stocks",https://www.benzinga.com/markets/penny-stocks/24/05/38821745/new-hotter-inflation-data-momo-buys-the-dip-fed-blunder-shows-up-in-roaring-meme-stocks,Benzinga
05-14-2024,Market Awaits CPI Data Due Wednesday,https://www.zacks.com/stock/news/2273597/market-awaits-cpi-data-due-wednesday,Zacks Investment Research
05-14-2024,PPI Shows Higher Wholesale Inflation; Meme Stocks Rule (Again),https://www.zacks.com/stock/news/2273592/ppi-shows-higher-wholesale-inflation-meme-stocks-rule-again,Zacks Investment Research
05-13-2024,Why Solar Energy Stocks Soared Today,https://www.fool.com/investing/2024/05/13/why-solar-energy-stocks-soared-today/,The Motley Fool
05-05-2024,"SunPower Stock Has 87% Upside, According to 1 Wall Street Analyst",https://www.fool.com/investing/2024/05/05/sunpower-stock-has-87-upside-according-to-1-wall-s/,The Motley Fool
05-04-2024,"Bargain Hunting in Solar Stocks: 1 to Avoid, 2 to Buy",https://www.fool.com/investing/2024/05/04/bargain-hunting-in-solar-stocks-1-to-avoid-2-to-bu/,The Motley Fool
05-01-2024,SunPower Stock Is Down 55% This Year. Is It a Buy?,https://www.fool.com/investing/2024/05/01/sunpower-stock-is-down-55-this-year-is-it-a-buy/,The Motley Fool
04-27-2024,Enphase Energy's Recovery Can't Come Soon Enough,https://www.fool.com/investing/2024/04/27/enphase-energys-recovery-cant-come-soon-enough/,The Motley Fool
04-24-2024,Earnings Preview: SunPower (SPWR) Q1 Earnings Expected to Decline,https://www.zacks.com/stock/news/2261324/earnings-preview-sunpower-spwr-q1-earnings-expected-to-decline,Zacks Investment Research
04-15-2024,Why Ultragenyx Pharmaceutical Shares Are Trading Lower By Around 9%? Here Are Other Stocks Moving In Monday's Mid-Day Session,https://www.benzinga.com/news/24/04/38255428/why-ultragenyx-pharmaceutical-shares-are-trading-lower-by-around-9-here-are-other-stocks-moving-in-m,Benzinga
04-10-2024,Have Solar Energy Stocks Finally Hit Rock Bottom?,https://www.fool.com/investing/2024/04/10/have-solar-energy-stocks-hit-rock-bottom/,The Motley Fool
04-09-2024,1 Wall Street Analyst Cuts SunPower's Price Target by 33%. Here's Why He's Right (and Wrong),https://www.fool.com/investing/2024/04/09/wall-street-analyst-cut-sunpower-price-target-why/,The Motley Fool
04-04-2024,How First Solar Crushed Its Solar Energy Rivals,https://www.fool.com/investing/2024/04/04/how-first-solar-wins/,The Motley Fool
