timestamp,title,url,source,sentiment,score,prob_positive,prob_neutral,prob_negative,net_sentiment,average_sentiment,sentiment_score_ranking
02-20-2025,Why Cameco Stock Jumped Today After Earnings,https://www.fool.com/investing/2025/02/20/why-cameco-stock-jumped-today-after-earnings/?source=iedfolrf0000001,The Motley Fool,neutral,0.8095968961715698,0.15729473531246185,0.8095968961715698,0.0331084206700325,0.12418631464242935,0.27036202683423954,0.6351810134171197
02-16-2025,"Cameco Corporation: Buy, Sell, or Hold?",https://www.fool.com/investing/2025/02/16/cameco-corporation-buy-sell-or-hold/?source=iedfolrf0000001,The Motley Fool,neutral,0.9297758936882019,0.027034945785999298,0.9297758936882019,0.04318913817405701,-0.01615419238805771,0.27036202683423954,0.6351810134171197
02-06-2025,1 Thing You Need to Know About Brookfield Renewable Stock Before You Buy,https://www.fool.com/investing/2025/02/06/1-thing-you-need-to-know-about-brookfield-renewabl/?source=iedfolrf0000001,The Motley Fool,neutral,0.9433304071426392,0.037217479199171066,0.9433304071426392,0.0194521676748991,0.017765311524271965,0.27036202683423954,0.6351810134171197
01-26-2025,The Best High-Yield Energy Stock to Invest $200 in Right Now,https://www.fool.com/investing/2025/01/26/the-best-high-yield-energy-stock-to-invest-200-in/?source=iedfolrf0000001,The Motley Fool,neutral,0.8652423024177551,0.12469807267189026,0.8652423024177551,0.010059653781354427,0.11463841889053583,0.27036202683423954,0.6351810134171197
01-24-2025,Brookfield Renewable Holdings SAS augmente le prix offert pour les OCEANEs 2022 dans le cadre de l'offre publique d'achat simplifiée portant sur les actions et OCEANEs de Neoen,https://www.globenewswire.com/news-release/2025/01/24/3015027/0/fr/Brookfield-Renewable-Holdings-SAS-augmente-le-prix-offert-pour-les-OCEANEs-2022-dans-le-cadre-de-l-offre-publique-d-achat-simplifi%C3%A9e-portant-sur-les-actions-et-OCEANEs-de-Neoen.html,GlobeNewswire Inc.,positive,0.6703959107398987,0.6703959107398987,0.3099961578845978,0.019607923924922943,0.6507879868149757,0.27036202683423954,0.6351810134171197
01-24-2025,Brookfield Renewable Holdings SAS increases the price offered for the 2022 OCEANEs as part of the simplified tender offer for the Neoen shares and OCEANEs,https://www.globenewswire.com/news-release/2025/01/24/3015027/0/en/Brookfield-Renewable-Holdings-SAS-increases-the-price-offered-for-the-2022-OCEANEs-as-part-of-the-simplified-tender-offer-for-the-Neoen-shares-and-OCEANEs.html,GlobeNewswire Inc.,positive,0.7427114844322205,0.7427114844322205,0.24552538990974426,0.011763162910938263,0.7309483215212822,0.27036202683423954,0.6351810134171197
